{
  "contract_version": "flyto.robotics.ros2-runtime-snapshot.v1",
  "profile_id": "flyto2.ros2.standard.v1",
  "profile_snapshot": "9da500f099541b4129fa089b5e83b5c643023aafaa04c6f164f4251902575630",
  "robot_id": "flyto-rover-sim-001",
  "deployment_mode": "simulation",
  "observed_at": "2026-08-01T10:00:00Z",
  "max_age_seconds": 60,
  "emergency_stop_ready": true,
  "adapters": [
    {
      "adapter_id": "ros2.nav2.navigate_to_pose.v1",
      "status": "ready",
      "interface_available": true,
      "lifecycle_state": "active",
      "observation_sequence": "synthetic-sim:ready:1"
    }
  ],
  "snapshot": "260b92a37ecc0bdd0aec2da9b3b93abc8f1ff622bb384e3265f575f69aee5467"
}
